{
  "instrument": {
    "os_name": "iOS",
    "microphone_display_name": "Dayton",
    "os_version": "Version 26.6.1 (Build 23G83)",
    "input_path": "Built-in input",
    "device_hardware_identifier": "iPhone16,1"
  },
  "schema_version": "1.0.0",
  "photo": {
    "filename": "photo.jpg",
    "included": true,
    "sha256": "742b829d9b3d36bf807e5a73b62f084743d26f07c775d0787223689706690db1"
  },
  "sound_level": {
    "lcpeak_db_c": 105.83092981282715,
    "lceq_db_c": 83.75267454364388,
    "lzeq_db_z": 87.13392981557101,
    "lafmax_db_a": 77.96240178650821,
    "lafmin_db_a": 62.54264269940728,
    "laeq_db_a": 68.13995522575621
  },
  "measurement": {
    "title": "One Minute Standing On London Bridge",
    "completed_at_utc": "2026-09-09T14:29:07Z",
    "duration_seconds": 70.70000000000026
  },
  "software": {
    "application_version": "1.0",
    "analysis_method_version": "spl-reference-1",
    "build": "2",
    "name": "DSR SPL Reference"
  },
  "calibration": {
    "status": "device_calibrated",
    "method": "Calibrated"
  },
  "attribution": {
    "display_name": null,
    "organisation": null,
    "mode": "anonymous"
  },
  "public_location": {
    "country_code": "GB",
    "visibility": "city",
    "region": null,
    "country_name": "United Kingdom",
    "city": "London",
    "approximate_area": null,
    "place_name": null
  },
  "measurement_settings": {
    "time_weightings": [
      "Fast",
      "Slow",
      "Impulse"
    ],
    "frequency_weightings": [
      "A",
      "C",
      "Z"
    ]
  },
  "environment": {
    "group_id": "streets_roads",
    "type_id": "urban_street",
    "taxonomy_version": "1"
  },
  "measurement_quality": {
    "classification": "device_calibrated"
  },
  "notes": "A beautiful view doesn’t necessarily come with a quiet soundtrack.\nThis one-minute measurement, taken from London Bridge while looking towards Tower Bridge, captures the acoustic reality behind one of London’s iconic views: traffic, people, the city in motion and the constant urban background all blending together.\nJust one minute standing still — how loud does London sound when you actually measure it?",
  "identity": {
    "public_measurement_id": "SPL-2026-000029",
    "measurement_uuid": "ddc2b132-536c-41d1-84cf-234ca2f21dfa",
    "record_version": "1.0"
  },
  "publisher": {
    "name": "Direct Sound Records",
    "application": "DSR SPL Reference"
  },
  "license": "CC-BY-4.0"
}
