{
  "measurement": {
    "title": "Office Open space",
    "completed_at_utc": "2026-09-02T12:31:53Z",
    "duration_seconds": 3600.8999999978205
  },
  "public_location": {
    "region": null,
    "place_name": null,
    "country_code": "GB",
    "country_name": "United Kingdom",
    "visibility": "city",
    "city": "London",
    "approximate_area": null
  },
  "software": {
    "application_version": "1.0",
    "analysis_method_version": "spl-reference-1",
    "name": "DSR SPL Reference",
    "build": "2"
  },
  "attribution": {
    "mode": "anonymous",
    "display_name": null,
    "organisation": null
  },
  "photo": {
    "filename": null,
    "included": false,
    "sha256": null
  },
  "measurement_settings": {
    "time_weightings": [
      "Fast",
      "Slow",
      "Impulse"
    ],
    "frequency_weightings": [
      "A",
      "C",
      "Z"
    ]
  },
  "instrument": {
    "device_hardware_identifier": "iPhone16,1",
    "os_version": "Version 26.6.1 (Build 23G83)",
    "microphone_display_name": "iPhone microphone",
    "input_path": "Built-in input",
    "os_name": "iOS"
  },
  "sound_level": {
    "lcpeak_db_c": 103.87566491349808,
    "lafmin_db_a": 43.913185625216755,
    "lzeq_db_z": 63.820164039959764,
    "lafmax_db_a": 87.13601772321435,
    "lceq_db_c": 62.96022712500001,
    "laeq_db_a": 57.3428375999608
  },
  "calibration": {
    "method": "Uncalibrated",
    "status": "indicative"
  },
  "measurement_quality": {
    "classification": "indicative"
  },
  "notes": "Environmental sound pressure level measurement recorded continuously for approximately one hour in the open-plan office of a large financial institution in London.\n\nThe measurement captures the typical acoustic environment experienced during everyday office work, including conversations, telephone and video calls, movement through the workspace, keyboards and office equipment, ventilation systems, and the cumulative background sound generated by a large number of people sharing an open space.\n\nUnlike measurements dominated by individual high-level events, this recording is intended to document sustained everyday workplace noise exposure. The one-hour duration captures both quieter periods and temporary increases in activity, providing a more representative picture of the changing sound environment experienced by someone working in the space.\n\nThe measurement forms part of the SPL Reference real-world environmental dataset, providing a reference for comparison with other workplaces, public spaces, transport environments, domestic settings, and urban locations.",
  "environment": {
    "taxonomy_version": "1",
    "group_id": "office_work",
    "type_id": "open_plan_office"
  },
  "schema_version": "1.0.0",
  "identity": {
    "public_measurement_id": "SPL-2026-000014",
    "measurement_uuid": "348fa4a5-9f42-4c73-bf1a-6086bf25858a",
    "record_version": "1.0"
  },
  "publisher": {
    "name": "Direct Sound Records",
    "application": "DSR SPL Reference"
  },
  "license": "CC-BY-4.0"
}
